{
  "$schema": "./schemas/workspace.schema.json",
  "kind": "world_os_workspace",
  "contractVersion": "0.1.0",
  "workspaceId": "workspace.world-matrix",
  "version": 1,
  "name": "万象织境",
  "phase": "startup",
  "repositoryRoot": "../..",
  "authority": {
    "singleWriter": true,
    "writer": {
      "kind": "codex",
      "id": "codex.root"
    },
    "writerIds": [
      "codex.root"
    ],
    "humanApprovalRequiredForCanon": true,
    "externalStateWrites": "forbidden"
  },
  "eventSourcing": {
    "appendOnly": true,
    "requireExpectedVersion": true,
    "proposalsNeverMutateCanon": true,
    "commitIsTerminalMarker": true,
    "currentHeadDerivedFromCommitChain": true
  },
  "stores": {
    "proposals": {
      "artifactKind": "world_os_event_proposal",
      "authority": "non_authoritative"
    },
    "events": {
      "artifactKind": "world_os_event_commit",
      "authority": "stream_authoritative",
      "appendOnly": true
    },
    "states": {
      "artifactKind": "world_os_state_snapshot",
      "authority": "commit_referenced_only"
    },
    "projections": {
      "artifactKind": "world_os_platform_projection",
      "derived": true,
      "rebuildable": true,
      "source": "terminal_commits"
    },
    "receipts": {
      "artifactKind": "world_os_publish_receipt",
      "authority": "delivery_evidence_only"
    }
  },
  "integrations": {
    "mcp": {
      "mode": "outbox_projection_only",
      "profilePath": "platforms/studio-platform.json",
      "profileRef": {
        "kind": "world_os_platform_profile",
        "id": "platform-profile.studio-private",
        "version": 1,
        "contentHash": "sha256:61332753dbb4e29e6e288857b607452ed8e365a5b110649cda1b2adf9a4e9037"
      },
      "canWriteCanon": false,
      "canCommitProposals": false,
      "requiresIdempotencyKey": true,
      "requiresExactSourceRefs": true,
      "feedbackRoute": "external_signal_proposal"
    },
    "llmAdapters": [
      {
        "id": "future.default",
        "enabled": false,
        "policyPath": "providers/future-llm-policy.json",
        "policyRef": {
          "kind": "world_os_llm_provider_policy",
          "id": "provider-policy.future.default",
          "version": 1,
          "contentHash": "sha256:5039f7ea2c15878bc7f2c99229e791d8938bf6ca55ab5b85109f7d7f0fedc64b"
        },
        "outputScope": "proposal_only",
        "canApprove": false,
        "canCommit": false,
        "canWriteState": false,
        "requiredOutputKind": "world_os_event_proposal",
        "budgetPolicy": {
          "maxCandidates": 3,
          "maxOutputTokens": 6000,
          "maxCostUsd": 0.5,
          "timeoutMs": 60000
        }
      }
    ]
  },
  "allocation": {
    "policy": "startup_70_20_10",
    "unit": "percent",
    "buckets": [
      {
        "id": "primary",
        "share": 70,
        "worldIds": [
          "W01"
        ]
      },
      {
        "id": "incubator",
        "share": 20,
        "worldIds": [
          "W02"
        ]
      },
      {
        "id": "lab",
        "share": 10,
        "worldIds": [
          "W03",
          "W04"
        ]
      }
    ]
  },
  "worlds": [
    {
      "id": "W01",
      "name": "临安春信",
      "portfolioRole": "primary",
      "stage": "world_bible_draft",
      "canonDisposition": "proposal",
      "documentRef": "doc.world.w01",
      "sourcePath": "worlds/W01.world.json",
      "initialStatePath": "states/W01.day0.json"
    },
    {
      "id": "W02",
      "name": "山海／天门",
      "portfolioRole": "incubator",
      "stage": "world_bible_draft",
      "canonDisposition": "proposal",
      "documentRef": "doc.world.w02",
      "sourcePath": "worlds/W02.world.json",
      "initialStatePath": "states/W02.day0.json"
    },
    {
      "id": "W03",
      "name": "雾城失物局",
      "portfolioRole": "lab",
      "stage": "candidate_card",
      "canonDisposition": "proposal",
      "documentRef": "doc.portfolio",
      "sourcePath": "worlds/W03.card.json"
    },
    {
      "id": "W04",
      "name": "潮生星港",
      "portfolioRole": "lab",
      "stage": "candidate_card",
      "canonDisposition": "proposal",
      "documentRef": "doc.portfolio",
      "sourcePath": "worlds/W04.card.json"
    }
  ],
  "documents": [
    {
      "id": "doc.meta",
      "path": "../../docs/examples/multi-world-studio/00-meta-bible.md",
      "role": "meta_bible",
      "version": "draft-v0.1",
      "status": "draft"
    },
    {
      "id": "doc.portfolio",
      "path": "../../docs/examples/multi-world-studio/01-world-portfolio.md",
      "role": "portfolio",
      "version": "draft-v0.1",
      "status": "draft"
    },
    {
      "id": "doc.world.w01",
      "path": "../../docs/examples/multi-world-studio/02-w01-linan-chunxin.md",
      "role": "world_bible",
      "worldId": "W01",
      "version": "draft-v0.1",
      "status": "draft"
    },
    {
      "id": "doc.world.w02",
      "path": "../../docs/examples/multi-world-studio/03-w02-shanhai-tianmen.md",
      "role": "world_bible",
      "worldId": "W02",
      "version": "draft-v0.1",
      "status": "draft"
    },
    {
      "id": "doc.simulation",
      "path": "../../docs/examples/multi-world-studio/05-canon-and-simulation.md",
      "role": "canon_simulation_policy",
      "version": "draft-v0.1",
      "status": "draft"
    },
    {
      "id": "doc.operations",
      "path": "../../docs/examples/multi-world-studio/07-studio-operations.md",
      "role": "operations",
      "version": "draft-v0.1",
      "status": "draft"
    },
    {
      "id": "doc.roadmap",
      "path": "../../docs/examples/multi-world-studio/08-roadmap-and-kpis.md",
      "role": "roadmap",
      "version": "draft-v0.1",
      "status": "draft"
    }
  ],
  "locks": [
    {
      "id": "lock.workspace.multi-world",
      "scope": "workspace",
      "subject": "工作室同时经营多个独立世界",
      "path": "/portfolio",
      "level": "hard",
      "status": "active",
      "sourceType": "user_intent",
      "value": true
    },
    {
      "id": "lock.workspace.codex-brain",
      "scope": "workspace",
      "subject": "Codex 是唯一编排大脑与权威写入者",
      "path": "/authority",
      "level": "hard",
      "status": "active",
      "sourceType": "user_intent",
      "value": "codex.root"
    },
    {
      "id": "lock.workspace.mcp-projection",
      "scope": "workspace",
      "subject": "MCP 只发布非权威平台投影",
      "path": "/integrations/mcp",
      "level": "hard",
      "status": "active",
      "sourceType": "user_intent",
      "value": "projection_only"
    },
    {
      "id": "lock.workspace.connection-l1",
      "scope": "workspace",
      "subject": "第一阶段仅使用 L1 软连接",
      "path": "/connectionPolicy/maxAllowedLevel",
      "level": "hard",
      "status": "proposed",
      "sourceType": "design_proposal",
      "value": "L1",
      "activationRequirement": "human_approval"
    },
    {
      "id": "lock.workspace.cross-world-canon",
      "scope": "workspace",
      "subject": "正式跨世界因果",
      "path": "/connectionPolicy/L3",
      "level": "undefined",
      "status": "unresolved",
      "sourceType": "design_unknown"
    }
  ],
  "connectionPolicy": {
    "phase": "phase_1",
    "maxAllowedLevel": "L1",
    "levels": [
      {
        "id": "L1",
        "status": "allowed",
        "canonEffect": "none",
        "description": "只共享母题、栏目语言和弱符号"
      },
      {
        "id": "L2",
        "status": "locked",
        "canonEffect": "unresolved_only",
        "minimumStableWorlds": 2
      },
      {
        "id": "L3",
        "status": "prohibited",
        "canonEffect": "cross_world_commit",
        "minimumStableWorlds": 3,
        "humanApprovalRequired": true
      }
    ]
  },
  "milestones": [
    {
      "id": "M01",
      "dayStart": 1,
      "dayEnd": 14,
      "state": "in_progress",
      "deliverables": [
        "机器可读治理规则",
        "W01/W02 提案种子",
        "持续审阅器"
      ],
      "review": {
        "status": "pending"
      },
      "gate": {
        "id": "gate.foundation",
        "decision": "pending"
      }
    },
    {
      "id": "M02",
      "dayStart": 15,
      "dayEnd": 30,
      "state": "planned",
      "deliverables": [
        "角色与地点探索候选",
        "W01 可复用内容原型"
      ],
      "review": {
        "status": "pending"
      },
      "gate": {
        "id": "gate.prototype",
        "decision": "pending"
      }
    },
    {
      "id": "M03",
      "dayStart": 31,
      "dayEnd": 60,
      "state": "planned",
      "deliverables": [
        "W01 叙事与生产验证",
        "W02 低成本机制测试"
      ],
      "review": {
        "status": "pending"
      },
      "gate": {
        "id": "gate.validation",
        "decision": "pending"
      }
    },
    {
      "id": "M04",
      "dayStart": 61,
      "dayEnd": 90,
      "state": "planned",
      "deliverables": [
        "持续发布节奏",
        "组合复盘与下一季度决策"
      ],
      "review": {
        "status": "pending"
      },
      "gate": {
        "id": "gate.portfolio",
        "decision": "pending"
      }
    }
  ]
}
